<?xml version="1.0" encoding="UTF-8"?>
<property-tagging-filter-config xmlns:xsi="http://www.w3.org/2001/XMLSchema-instance" xsi:schemaLocation="http://www.watch4net.com/APG/Filter/PropertyTaggingFilter  property-tagging-filter-config.xsd" xmlns="http://www.watch4net.com/APG/Filter/PropertyTaggingFilter">
	<refresh unit="minutes">0</refresh>
	<files>
		<text-file path="conf/rename_grp.csv">
			<accessor accessor-class="StaticAccessor">
				<parameter name="field-separator">,</parameter>
				<parameter name="field-quoting">"</parameter>
				<parameter name="line">[datagrp][serialnb][parttype][part][name]</parameter>
			</accessor>
			<field-separator>,</field-separator>
			<default-symbol>**</default-symbol>
			<property-insertion start="[" end="]" />
			<key-properties>
			</key-properties>
			<new-properties>
				<new-property>RV_Variable</new-property>      
			</new-properties>
		</text-file>
	</files>
</property-tagging-filter-config>