<?xml version="1.0" encoding="UTF-8"?>
<!--
* Copyright (c) 2014 EMC Corporation
* All Rights Reserved
*
* This software contains the intellectual property of EMC Corporation
* or is licensed to EMC Corporation from third parties.  Use of this
* software and the intellectual property contained therein is expressly
* limited to the terms and conditions of the License Agreement under which
* it is provided by or on behalf of EMC.
-->
<property-tagging-filter-config xmlns:xsi="http://www.w3.org/2001/XMLSchema-instance" xmlns="http://www.watch4net.com/APG/Filter/PropertyTaggingFilter" xsi:schemaLocation="http://www.watch4net.com/APG/Filter/PropertyTaggingFilter  property-tagging-filter-config.xsd">
	<refresh unit="minutes">60</refresh>
	<files>
		<!-- sets parttype & !part after ICF -->
		<text-file path="conf/overrideHDDCapacity.csv">
			<accessor accessor-class="StaticAccessor">
				<parameter name="field-separator">,</parameter>
				<parameter name="field-quoting">"</parameter>
				<parameter name="line">FileSystem,HDDCapacity,Disk,</parameter>
				<parameter name="line">FileSystem,HDDUsedCapacity,Disk,</parameter>
				<parameter name="line">FileSystem,HDDFreeCapacity,Disk,</parameter>
			</accessor>
			<field-separator>,</field-separator>
			<default-symbol>**</default-symbol>
			<property-insertion start="[" end="]" />
			<key-properties>
				<key-property delete-after-use="false" string-type="string">parttype</key-property>
				<key-property delete-after-use="false" string-type="string">name</key-property>
			</key-properties>
			<new-properties>
				<new-property>parttype</new-property>      
				<new-property>part</new-property>      
			</new-properties>
		</text-file>
		<text-file path="conf/rename_variableid_isilon.csv">
			<accessor accessor-class="StaticAccessor">
				<parameter name="field-separator">,</parameter>
				<parameter name="field-quoting">"</parameter>
				<parameter name="line">[source][serialnb][nodeid][parttype][part][name]</parameter>
			</accessor>
			<field-separator>,</field-separator>
			<default-symbol>**</default-symbol>
			<property-insertion start="[" end="]" />
			<key-properties>
			</key-properties>
			<new-properties>
				<new-property>RV_Variable</new-property>      
			</new-properties>
		</text-file>
	</files>
</property-tagging-filter-config>